<?xml version="1.0" encoding="Windows-1252"?>
<xs:schema xmlns="http://tempuri.org/circuito" elementFormDefault="qualified" targetNamespace="http://tempuri.org/circuito" xmlns:xs="http://www.w3.org/2001/XMLSchema">
	<xs:element name="circuito">
		<xs:complexType>
			<xs:sequence>
				<xs:element ref="nombre" />
				<xs:element ref="longitudCircuito" />
				<xs:element ref="anchuraMedia" />
				<xs:element ref="fecha" />
				<xs:element ref="hora" />
				<xs:element ref="numVueltas" />
				<xs:element ref="localidad" />
				<xs:element ref="pais" />
				<xs:element ref="nombrePatrocinador" />
				<xs:element ref="referencias" />
				<xs:element ref="galeriaFotos" />
				<xs:element ref="galeriaVideos" />
				<xs:element ref="puntoOrigen" />
				<xs:element ref="puntosAnonimos" />
				<xs:element ref="ganador" />
				<xs:element ref="clasificacion" />
			</xs:sequence>
		</xs:complexType>
	</xs:element>
	<xs:element name="nombre" type="xs:string" />
	<xs:element name="longitudCircuito">
		<xs:complexType>
			<xs:simpleContent>
				<xs:extension base="xs:positiveInteger">
					<xs:attribute name="unidades" type="xs:string" use="required" />
				</xs:extension>
			</xs:simpleContent>
		</xs:complexType>
	</xs:element>
	<xs:element name="anchuraMedia">
		<xs:complexType>
			<xs:simpleContent>
				<xs:extension base="xs:positiveInteger">
					<xs:attribute name="unidades" type="xs:string" use="required" />
				</xs:extension>
			</xs:simpleContent>
		</xs:complexType>
	</xs:element>
	<xs:element name="fecha" type="xs:date" />
	<xs:element name="hora" type="xs:time" />
	<xs:element name="numVueltas" type="xs:positiveInteger" />
	<xs:element name="localidad" type="xs:string" />
	<xs:element name="pais" type="xs:string" />
	<xs:element name="nombrePatrocinador" type="xs:string" />
	<xs:element name="referencias">
		<xs:complexType>
			<xs:sequence>
				<xs:element minOccurs="1" maxOccurs="unbounded" ref="referencia" />
			</xs:sequence>
		</xs:complexType>
	</xs:element>
	<xs:element name="referencia" type="xs:string" />
	<xs:element name="galeriaFotos">
		<xs:complexType>
			<xs:sequence>
				<xs:element minOccurs="3" maxOccurs="unbounded" ref="foto" />
			</xs:sequence>
		</xs:complexType>
	</xs:element>
	<xs:element name="foto" type="xs:string" />
	<xs:element name="galeriaVideos">
		<xs:complexType>
			<xs:sequence>
				<xs:element minOccurs="1" maxOccurs="3" ref="video" />
			</xs:sequence>
		</xs:complexType>
	</xs:element>
	<xs:element name="video" type="xs:string" />
	<xs:element name="puntoOrigen">
		<xs:complexType>
			<xs:sequence>
				<xs:element ref="punto" />
			</xs:sequence>
		</xs:complexType>
	</xs:element>
	<xs:element name="punto">
		<xs:complexType>
			<xs:sequence>
				<xs:element ref="longitud" />
				<xs:element ref="latitud" />
				<xs:element ref="altitud" />
			</xs:sequence>
		</xs:complexType>
	</xs:element>
	<xs:element name="longitud" type="xs:float" />
	<xs:element name="latitud" type="xs:float" />
	<xs:element name="altitud" type="xs:float" />
	<xs:element name="puntoAnonimo">
    <xs:complexType>
        <xs:sequence>
            <xs:element minOccurs="1" maxOccurs="unbounded" ref="punto" />
        </xs:sequence>
        <xs:attribute name="distancia" type="xs:string" use="required" />
        <xs:attribute name="sector" type="xs:string" use="required" />
    </xs:complexType>
</xs:element>
	<xs:element name="sector" type="xs:string" />
	<xs:element name="ganador">
		<xs:complexType>
			<xs:sequence>
				<xs:element ref="nombrePiloto" />
				<xs:element ref="tiempo" />
			</xs:sequence>
		</xs:complexType>
	</xs:element>
	<xs:element name="nombrePiloto" type="xs:string" />
	<xs:element name="tiempo" type="xs:duration" />
	<xs:element name="clasificacion">
		<xs:complexType>
			<xs:sequence>
				<xs:element ref="primero" />
				<xs:element ref="segundo" />
				<xs:element ref="tercero" />
			</xs:sequence>
		</xs:complexType>
	</xs:element>
	<xs:element name="primero" type="xs:string" />
	<xs:element name="segundo" type="xs:string" />
	<xs:element name="tercero" type="xs:string" />
</xs:schema>